{
  "version": "AOF_SOC_GRADE_OWNER_REVIEW_CATALOGUE_V0_1",
  "originIssue": "#152",
  "source": {
    "title": "Age of Friends — Statistics-to-Social Interpretation Matrix",
    "sourceLabel": "Metric grading owner-review proposal v0.1",
    "checkpointQuoted": "e453d40c147ad488f3bfd369e54eba82b29c43b5",
    "verbatimRepositoryPath": "docs/architecture/grade-reputation-metrics-owner-review-v0.1.md",
    "verbatimGitBlobSha": "c4c4df316f023a39f6e112562042f4e5c0ad26ff",
    "transcriptionStatus": "SUPPLIED_OWNER_REVIEW_PROPOSAL_NOT_FINAL_APPROVAL",
    "ownerConfirmedAsFinalPolicy": false
  },
  "policyStatus": "PROPOSED_UNAPPROVED",
  "approvalRef": null,
  "tracks": [
    {
      "track": "GALLANTRY",
      "system": "REPUTATION",
      "definition": "Meaningful daring offensive action in genuinely challenging entry circumstances.",
      "approvalStatus": "PROPOSED_UNAPPROVED"
    },
    {
      "track": "CRUELTY",
      "system": "REPUTATION",
      "definition": "Meaningful directed punishing pressure against a demonstrably disadvantaged opponent, or separately qualified economic betrayal.",
      "approvalStatus": "PROPOSED_UNAPPROVED"
    },
    {
      "track": "CHIVALRY",
      "system": "REPUTATION",
      "definition": "Noteworthy directed protection or help.",
      "approvalStatus": "PROPOSED_UNAPPROVED"
    },
    {
      "track": "RIVALRY",
      "system": "RELATIONSHIP",
      "definition": "A's substantive competition or counterplay against B.",
      "approvalStatus": "PROPOSED_UNAPPROVED"
    },
    {
      "track": "HOSTILITY",
      "system": "RELATIONSHIP",
      "definition": "A's distinct antagonism toward B beyond routine warfare.",
      "approvalStatus": "PROPOSED_UNAPPROVED"
    },
    {
      "track": "BOND",
      "system": "RELATIONSHIP",
      "definition": "A's meaningful help to B.",
      "approvalStatus": "PROPOSED_UNAPPROVED"
    }
  ],
  "independenceRules": [
    "REPUTATION_DIMENSIONS_INDEPENDENT",
    "RELATIONSHIP_A_TO_B_DIRECTIONAL_INDEPENDENT"
  ],
  "notation": {
    "Q": "Candidate strengthening, only if the track's independently justified conduct, context, identity and materiality predicates qualify.",
    "c": "Supporting context only. Cannot itself produce a track change.",
    "·": "Ordinarily no direct contribution.",
    "W": "Candidate weakening, requiring a separately justified positive action and approved predicate."
  },
  "metricFamilies": [
    {
      "rowId": "OWNER_V0_1_M01",
      "sourceMetricOrEpisodeFamily": "Detected Raids Initiated / directed economic pressure",
      "notation": {
        "GALLANTRY": "Q",
        "CRUELTY": "Q",
        "CHIVALRY": "·",
        "RIVALRY": "Q",
        "HOSTILITY": "c",
        "BOND": "·"
      },
      "qualificationContext": "Targeted, substantive, opponent-specific; challenge or prior vulnerability independently qualified.",
      "sourceMetricDefinitionId": null,
      "sourceMethodVersion": null,
      "methodSpecificCoverageApproval": null,
      "ownerSelectionStatus": "PROPOSED_UNAPPROVED"
    },
    {
      "rowId": "OWNER_V0_1_M02",
      "sourceMetricOrEpisodeFamily": "Detected Battles / Skirmishes, pair-local contest",
      "notation": {
        "GALLANTRY": "Q",
        "CRUELTY": "Q",
        "CHIVALRY": "·",
        "RIVALRY": "Q",
        "HOSTILITY": "c",
        "BOND": "·"
      },
      "qualificationContext": "Attribution and individual participation, not mere episode count.",
      "sourceMetricDefinitionId": null,
      "sourceMethodVersion": null,
      "methodSpecificCoverageApproval": null,
      "ownerSelectionStatus": "PROPOSED_UNAPPROVED"
    },
    {
      "rowId": "OWNER_V0_1_M03",
      "sourceMetricOrEpisodeFamily": "Return raid / independent reverse pressure",
      "notation": {
        "GALLANTRY": "Q",
        "CRUELTY": "Q",
        "CHIVALRY": "·",
        "RIVALRY": "Q",
        "HOSTILITY": "c",
        "BOND": "·"
      },
      "qualificationContext": "Reverse actor's own distinct action; chronology; no revenge motive.",
      "sourceMetricDefinitionId": null,
      "sourceMethodVersion": null,
      "methodSpecificCoverageApproval": null,
      "ownerSelectionStatus": "PROPOSED_UNAPPROVED"
    },
    {
      "rowId": "OWNER_V0_1_M04",
      "sourceMetricOrEpisodeFamily": "Substantive defensive counterplay against an attacker",
      "notation": {
        "GALLANTRY": "c",
        "CRUELTY": "·",
        "CHIVALRY": "·",
        "RIVALRY": "Q",
        "HOSTILITY": "c",
        "BOND": "·"
      },
      "qualificationContext": "Defender actively resisted, repositioned or protected; passive victimhood is insufficient.",
      "sourceMetricDefinitionId": null,
      "sourceMethodVersion": null,
      "methodSpecificCoverageApproval": null,
      "ownerSelectionStatus": "PROPOSED_UNAPPROVED"
    },
    {
      "rowId": "OWNER_V0_1_M05",
      "sourceMetricOrEpisodeFamily": "Direct opponent targeting in team Battle",
      "notation": {
        "GALLANTRY": "Q",
        "CRUELTY": "Q",
        "CHIVALRY": "·",
        "RIVALRY": "Q",
        "HOSTILITY": "c",
        "BOND": "·"
      },
      "qualificationContext": "Selective attention requires comparison with actual alternative opponents/opportunities.",
      "sourceMetricDefinitionId": null,
      "sourceMethodVersion": null,
      "methodSpecificCoverageApproval": null,
      "ownerSelectionStatus": "PROPOSED_UNAPPROVED"
    },
    {
      "rowId": "OWNER_V0_1_M06",
      "sourceMetricOrEpisodeFamily": "Forward Buildings and Forward Eco placements",
      "notation": {
        "GALLANTRY": "c",
        "CRUELTY": "c",
        "CHIVALRY": "·",
        "RIVALRY": "Q",
        "HOSTILITY": "c",
        "BOND": "·"
      },
      "qualificationContext": "Specific opponent, geometry, genuine directed contest; no completion claimed.",
      "sourceMetricDefinitionId": null,
      "sourceMethodVersion": null,
      "methodSpecificCoverageApproval": null,
      "ownerSelectionStatus": "PROPOSED_UNAPPROVED"
    },
    {
      "rowId": "OWNER_V0_1_M07",
      "sourceMetricOrEpisodeFamily": "Towers / Tower Rush with directed pressure",
      "notation": {
        "GALLANTRY": "c",
        "CRUELTY": "Q",
        "CHIVALRY": "·",
        "RIVALRY": "Q",
        "HOSTILITY": "c",
        "BOND": "·"
      },
      "qualificationContext": "Punishing vulnerability needed for Cruelty; zoning alone is not Hostility.",
      "sourceMetricDefinitionId": null,
      "sourceMethodVersion": null,
      "methodSpecificCoverageApproval": null,
      "ownerSelectionStatus": "PROPOSED_UNAPPROVED"
    },
    {
      "rowId": "OWNER_V0_1_M08",
      "sourceMetricOrEpisodeFamily": "Castle placement near opponent home",
      "notation": {
        "GALLANTRY": "c",
        "CRUELTY": "Q",
        "CHIVALRY": "·",
        "RIVALRY": "Q",
        "HOSTILITY": "c",
        "BOND": "·"
      },
      "qualificationContext": "Generic contested placement only; special Forward Castle achievement remains separately proof-gated.",
      "sourceMetricDefinitionId": null,
      "sourceMethodVersion": null,
      "methodSpecificCoverageApproval": null,
      "ownerSelectionStatus": "PROPOSED_UNAPPROVED"
    },
    {
      "rowId": "OWNER_V0_1_M09",
      "sourceMetricOrEpisodeFamily": "Gold Influence ≈ / contested gold-infrastructure positions",
      "notation": {
        "GALLANTRY": "c",
        "CRUELTY": "c",
        "CHIVALRY": "·",
        "RIVALRY": "Q",
        "HOSTILITY": "c",
        "BOND": "·"
      },
      "qualificationContext": "Rival ownership/contest not inferred from percent alone; no mined gold/real capture.",
      "sourceMetricDefinitionId": null,
      "sourceMethodVersion": null,
      "methodSpecificCoverageApproval": null,
      "ownerSelectionStatus": "PROPOSED_UNAPPROVED"
    },
    {
      "rowId": "OWNER_V0_1_M10",
      "sourceMetricOrEpisodeFamily": "Cooperative Attacks against exact common enemy",
      "notation": {
        "GALLANTRY": "c",
        "CRUELTY": "c",
        "CHIVALRY": "·",
        "RIVALRY": "Q",
        "HOSTILITY": "c",
        "BOND": "c"
      },
      "qualificationContext": "Each attacker's own target-specific action may count versus enemy; common target alone cannot create ally Bond.",
      "sourceMetricDefinitionId": null,
      "sourceMethodVersion": null,
      "methodSpecificCoverageApproval": null,
      "ownerSelectionStatus": "PROPOSED_UNAPPROVED"
    },
    {
      "rowId": "OWNER_V0_1_M11",
      "sourceMetricOrEpisodeFamily": "Defensive Assists (specific helper→recipient)",
      "notation": {
        "GALLANTRY": "·",
        "CRUELTY": "·",
        "CHIVALRY": "Q",
        "RIVALRY": "·",
        "HOSTILITY": "c",
        "BOND": "Q"
      },
      "qualificationContext": "Intervention in independently threatened recipient's defense, materiality; not automatic rescue.",
      "sourceMetricDefinitionId": null,
      "sourceMethodVersion": null,
      "methodSpecificCoverageApproval": null,
      "ownerSelectionStatus": "PROPOSED_UNAPPROVED"
    },
    {
      "rowId": "OWNER_V0_1_M12",
      "sourceMetricOrEpisodeFamily": "Reinforcements Sent (specific helper→recipient)",
      "notation": {
        "GALLANTRY": "·",
        "CRUELTY": "·",
        "CHIVALRY": "Q",
        "RIVALRY": "·",
        "HOSTILITY": "c",
        "BOND": "Q"
      },
      "qualificationContext": "Real source-linked protective participation rather than nearby move/co-presence.",
      "sourceMetricDefinitionId": null,
      "sourceMethodVersion": null,
      "methodSpecificCoverageApproval": null,
      "ownerSelectionStatus": "PROPOSED_UNAPPROVED"
    },
    {
      "rowId": "OWNER_V0_1_M13",
      "sourceMetricOrEpisodeFamily": "Defensive support under third-party pressure",
      "notation": {
        "GALLANTRY": "·",
        "CRUELTY": "·",
        "CHIVALRY": "Q",
        "RIVALRY": "·",
        "HOSTILITY": "c",
        "BOND": "Q"
      },